翻訳ID,日本語,英語,中国語（簡体字）,韓国語,備考
,違う気がする……。,"чем еда, которую подавали в Гимназии...",跟在银河学园见过的那些不大一样。,확실히 다른 것 같다……,
day21_142,\C[1]（ラビ？　何してるんだろう）,\C[1](Раби? Что он задумал?),\C[1]（拉比？他在干嘛啊）,\C[1](라비잖아? 뭐 하는 거지?),
day21_143,……,...,……,……,
day21_144,\>買う（50z),\>Купить (50z),\>购买（50z）,\>구매한다(50z),
day21_145,\>やめておく,\>Не покупать,\>算了,\>그만둔다,
day21_146,………………。,...,………………,………………,
day21_147,今日はダイブの仕事は無しだ！,Сегодня никакой работы с погружением!,今天我这没活给你干！,오늘 다이브 관련 일은 없어!,
,リーダーからの連絡を確認しろよ。,Ты свободен. Но проверь сообщения от,但如果首领找你，要马上看消息啊。,리더의 연락을 확인해 봐.,
,,Босса.,,,
day21_148,「ゼロデイカード　全１２種類！,"""Коллекционные Карты Нулевого Дня:,【零日群星卡　共计12种！,"""Zero Day 카드 총12종!",
,,"Взломай все двенадцать!"""
,ノーマル…80%　レア…20%」,Обычные: 80% Редкие: 20%»,普通…80%　稀有…20%】,"일반…80% 희귀…20%""",
day22_001,ねえ。,"Эм... Джо-Джо?",喂。,저기.,
day22_002,……どうしたの？,В чём дело?,……怎么了？,……왜 그래?,
day22_003,変な物音がするの。,Я слышала странный шум.,好像有奇怪的响动。,이상한 소리가 들려.,
day22_004,嫌な予感がする。,Что-то не так.,感觉会发生不好的事。,안 좋은 예감이 들어.,
day22_005,……物音？,Не так? В каком смысле?,……响动？,……소리라고?,
day22_006,そう。物音。,Как будто вот-вот случится что-то плохое.,对。响动。,맞아. 소리.,
day22_007,甘い夢の時間はおしまい。,"Мы мечтали о многом, но...",美美的梦就要醒了。,꿈 같은 시간은 끝나고.,
,これから現実がはじまるんだよ。\|,это не могло длиться вечно.,接下来该面对现实了。\|,지금부터 현실이 시작될 거야.\|,
,あの人の言う通り。,Нам пора взглянуть правде в глаза.\|,就像那个人说的一样。,그 사람이 말한 것처럼.,
,,Они всё это время были правы.,,,
day22_008,あの人？,Кто «они»?,……哪个人？,그 사람이라니?,
,……どういう意味？,Я не понимаю...,什么意思？,……대체 무슨 뜻이야?,
day22_009,誰かが街に入ってきた気がするの。,"Слушай, в городе могут быть вторженцы.",很可能有人闯进来了。,누가 여기에 침입한 것 같아.,
day22_010,ケイトは橋のほうを見てくるから、,"Я пойду проверю всё у моста,",凯特去桥那边看一眼。,케이트는 다리 쪽을 보고 올게.,
,ジョー君は診療所のあたりを,а ты не мог бы осмотреться возле,阿乔，,조는 진료소 주변을,
,調べてきてくれないかな？,клиники Дока?,你可以帮忙看看诊所那边吗？,조사해 줄래?,
day22_011,いいけど……,"Конечно, но...",可以是可以……,문제 없긴 한데……,
day22_012,よろしく！,"Огромное спасибо, малыш!",那就交给你啦！,"그럼, 부탁해!",
,じゃあねっ！,"Я знала, что могу на тебя рассчитывать.",拜拜！,조금 이따 봐!,
day22_013,ぐっすり眠っている。,Ви практически в отключке.,睡得很熟。,푹 잠든 것 같다.,
,起きる気配はない。,Она не проснётся в ближайшее время.,没有要醒的迹象。,일어날 기색은 보이지 않는다.,
day22_014,丸まって眠っている。,Юми свернулась калачиком... крепко спит.,缩成一团睡着。,웅크린 채 잠들어 있다.,
,起きる気配はない。,Лучше мне её не будить.,没有要醒的迹象。,일어날 기색은 보이지 않는다.,
day22_015,床に転がって寝ている。,"Похоже, Раби отрубился на полу.",睡在地板上。,바닥에서 뒹군 채로 잠들어 있다.,
,起きる気配はない。,Вряд ли так удобно спать.,没有要醒的迹象。,일어날 기색은 보이지 않는다.,
day22_016,ソファで体を縮こまらせて寝ている。,Док крепко спит на диване.,蜷在沙发上睡。,소파에 누워 잠들어 있다.,
,起きる気配はない。,"Похоже, ему действительно нужен отдых.",没有要醒的迹象。,일어날 기색은 보이지 않는다.,
day22_017,きれいに平らげられている。,Еду съели до последней крошки.,吃得干干净净。,접시가 말끔히 비워져 있다.,
day22_018,今はそれどころじゃないな。,Лучше мне сейчас там не вынюхивать.,暂时没空管这边了。,지금은 이럴 때가 아닌 것 같다.,
day22_018_2,この先はケイトが見てくれてるんだよな。,"Кейт пошла вперёд всё проверить,",凯特说她会去看前面的情况。,이 앞은 케이트가 조사 중일 거야.,
,診療所あたりを調べないと。,так что мне нужно проверить,我负责的是诊所那边。,진료소 쪽을 조사해 보자.,
,,всё возле клиники.,,,
day22_019,……………,...,……………,……………,
day22_020,眠っているようだ。,"Похоже, они спят.",好像在睡觉。,자는 것 같다.,
day22_021,うずくまったまま、,"Должно быть, они присели на",缩成一团，,웅크린 채,
,うとうとしているようだ。,корточки и стали клевать носом,迷迷糊糊地打着瞌睡。,꾸벅꾸벅 조는 것 같다.,
,,прямо на месте.,,,
day22_022,………………,...,………………,………………,
day22_023,無気力に立っている。,Они выглядят довольно взбешёнными.,无力地站在那儿。,힘없이 서 있다.,
,話しかけるのはやめておこう。,"Не думаю, что мне стоит вмешиваться.",还是别去搭话了。,말을 걸지 않는 편이 좋을 것 같다.,
day22_024,…………ZZZ……,*Хр-р-р*...,…………ZZZ……,…………쿨……,
day22_025,中は静かだ。,Внутри полная тишина.,里面安安静静。,안쪽은 조용하다.,
day22_026,いつもと変わらないけどな……,Здесь ничего необычного.,跟平时没什么不同啊……,평소와 다른 건 없는 것 같은데……,
,もう少し先まで行ってみるか。,"Может, осмотрюсь ещё немного.",再走远一点吧。,좀 더 안쪽으로 가볼까?,
day22_add18,栽培プラントだ。,Это культивационная установка.,培育植物的大棚。,재배 플랜트다.,
,ここでスプロール・ハイヴの,"Похоже, здесь выращивают еду для",蔓生之巢的食材,여기서 스프롤 하이브의,
,食料が作られているようだ。,Ульевых Просторов.,似乎就是在这里生产。,식량을 생산하는 것 같다.,
day22_add19,食料が並んだ屋台だ。,"Это ларёк, заставленный едой.",摆满食材的小摊。,식재료를 파는 노점이다.,
,プラントで採れたものだろう。,"Вероятно, её вырастили на установке.",应该都是从大棚里采摘的。,플랜트에서 재배한 것 같다.,
day22_add20,箱に様々な天然野菜が詰められている。,Ящики набиты свежими овощами.,装满了各种天然蔬菜。,각종 천연 야채가 상자 안에 들어 있다.,
day22_027,ヨウ！　ジョバンニ！,"ПРИВЕТИКИ, ДЖОВАННИ!",[呦！乔班尼！],"이봐, 조반니!",
day22_028,まさか……マーク？,Не может быть... Марк?!,你是……马克？,이 목소리는…… 마크?,
,こっちにも感染して……,О нет. Это тоже заражено?,连这个都被感染了……,감염이 거기까지……,
day22_029,オレハドコニデモイルゼ！,ХА! Я ПОВСЮДУ И СРАЗУ ВЕЗДЕ!,[本大爷无处不在哦！],난 어디든 존재하거든!,
day22_029_2,ソレヨリ……,"НО ЗНАЕШЬ ЧТО, БЛОНДИНЧИК?",[比起这个……,그건 그렇고……,
day22_030,ジョバンニ、オマエ,ДОЛЖЕН ОТДАТЬ ТЕБЕ ДОЛЖНОЕ!,乔班尼，,"조반니 너,",
,人気者ナンダッテナ！,ТЫ ТУТ ПОПУЛЯРЕН.,听说你是个大红人啊！],인기가 참 많던데~!,
day22_031,チョウドイイカラ,ЭТО ПРИГОДИТСЯ,[你这么有名气，,마침 잘 됐어.,
,ツカワセテモラッタゼ！,"ДЛЯ ТОГО, ЧТО БУДЕТ ДАЛЬШЕ!",刚好让我利用利用！],녀석을 써먹어 볼까!,
day22_032,……\.\.どういう意味だ？,...\.\.Что это должно означать?,……\.\.什么意思？,……\.\.그게 무슨 뜻이지?,
day22_033,昨日ハ、イイトコロデ,"СКАЖЕМ ТАК, ТЫ ВЛЕЗ НЕ В СВОЁ ДЕЛО",[昨天紧要关头，,어제는 한창 좋을 때에,
,邪魔シテクレチャッテサア……,КАК РАЗ ВЧЕРА И В САМОЕ,被你坏了好事……],방해를 받았잖아……?,
,,НЕПОДХОДЯЩЕЕ ВРЕМЯ.,,,
day22_034,オマエノコト,И ПОЗВОЛЬ СКАЗАТЬ ТЕБЕ...,[本大爷当然,"덕분에, 나도 굉장히",
,ムカツイテタンダヨ！,ТЫ МЕНЯ КОРОЛЕВСКИ ВЗБЕСИЛ.,很生你的气啊！],열 받았단 말씀!!,
day22_034_2,ダカラオ友達ヲ呼ンダゼ！,ПОЭТОМУ Я ПОЗВАЛ КОЕ-КАКИХ ДРУЗЕЙ!,[所以叫了几个朋友来咯！],그래서 친구를 좀 불러 왔지!,
day22_035,友達って\.\.…\.\.…,Друзей...?\.\.,朋友？\.\.…\.\.…,친구라니\.\.…\.\.…,
day22_036,可愛ガッテモラエヨ～！,ПОВЕСЕЛИСЬ! ОНИ ЛЮБЯТ ЖЁСТКО,[就让他们好好疼爱你吧～！],사이좋게 지내라고~!,
,,ПОИГРАТЬ!,,,
day22_037,……,...,……,……,
day22_038,……床や壁が血に汚れている。,Комната вся в крови.,……地上，墙上，都是血。,……바닥과 벽이 피로 얼룩져 있다.,
day22_039,乱暴に開けられている。,Дверь была вырвана в суматохе.,被粗暴地撬开了。,강제로 뜯겨지듯 열려 있다.,
day22_040,ロッカーが倒されている。,Всё было опрокинуто.,柜子倒在地上。,사물함이 쓰러져 있다.,
day22_041,……ひどい有様だ。,Какого хера здесь произошло...?,……一派惨状。,……끔찍한 광경이다.,
day22_042,息をしていない。,Раби не дышит.,没探到鼻息。,숨을 쉬지 않는다.,
day22_042_b,息をしていない。,Он не дышит.,没探到鼻息。,숨을 쉬지 않는다.,
day22_043,よく調べる,Проверить его жизненные показатели,仔细探查,자세히 살펴본다,
day22_044,……死んでいる。,"О, боже... Он мёртв.",……他死了。,……싸늘하다.,
day22_045,……,...,……,……,
day22_046,ジョバンニ！,Джованни!,乔班尼！,조반니!,
day22_047,無事か！？,Ты не ранен?!,你没事吧？！,괜찮나?!,
day22_048,ドク……,"Док, я...",大夫……,독 씨……,
day22_049,な、なにが……？,Я не понимаю.,到底……怎么……？,"이, 이게 대체……？",
,……なんで……,Что происходит...?,……为什么……会……,……어째서……,
day22_050,無事みたいだな。,"Слава богу, ты в порядке.",看样子没事。,무사한 것 같구나.,
day22_051,……悪いが、あんま話し込んでる余裕はねえ。,Я повсюду тебя искал.,……抱歉，暂时没空细说了。,……느긋하게 이야기할 시간은 없지만 말이다.,
,お前を探してたんだ。こっちに来い。,"Следуй за мной, я всё объясню позже.",我找你半天了。快跟我来。,찾아다녔다. 따라오거라.,
day22_052,\C[1]（ひどい血の量だ……）,\C[1](Здесь повсюду кровь...),\C[1]（好多血……）,\C[1](피를 많이 흘렸어……),
day22_053,Wiは？　無事なのか？,Где Ви? Она в порядке?,Wi呢？她没事吧？,Wi는 무사한가요?,
day22_054,それが……わかんねえんだ。,"Я... не уверен. Надеюсь, что да.",其实……我也不知道。,그게…… 나도 모르겠다.,
,怪我したままどっか行っちまった。,"Она сбежала, но была ранена.",她带着伤，不知跑哪去了。,상처입은 몸을 끌고 어디로 가더군.,
day22_055,ユミは？,А что Юми?,由美呢？,유미는요?,
day22_056,あいつはWiを追いかけてった。,"Она рванула за Ви, но я понятия не имею,",由美追着Wi跑走了。,유미는 Wi를 쫓아갔다.,
,今はどうしてるか分かんねえ。,"куда они делись... И вдобавок ко всему,",不清楚她具体情况怎样。,그 뒤는 나도 몰라.,
day22_057,ケイトは連絡がつかねえ。,я не могу связаться с Кейт.,凯特则是完全联系不上。,케이트와는 연락이 닿지 않고.,
day22_058,……,...,……,……,
day22_059,……ともかく、本題だ。,Но... сначала о главном. У меня есть,……总之，进入正题。,……본론을 말하마.,
,お前にWiから伝言がある。,для тебя сообщение от Ви.,Wi有话要我带给你。,Wi가 네게 남긴 전언이다.,
day22_060,端末を探せってさ。,"Она хочет, чтобы ты нашёл её компьютер.",她说，让你去找“终端”。,단말을 찾거라.,
day22_061,端末って？,А? Какой компьютер?,终端？什么终端？,단말이라뇨?,
day22_062,さあな。,Понятия не имею.,不清楚。,글쎄다.,
,お前のほうが詳しいだろ。,"Я думал, ты будешь знать.",你应该比我了解吧。,그건 네가 더 잘 알 거다.,
day22_063,R-codeは「PERFECT BLUE」と,"Если найдёшь его, R-коды —",她还说，R-code是“PERFECT BLUE”，,"R-codes는 ""PERFECT BLUE"",",
,「PAPRIKA」だそうだ。,«ИСТИННАЯ ГРУСТЬ» и «ПАПРИКА».,以及“PAPRIKA”。,"""PAPRIKA"" 라더구나.",
day22_064,ドア……,,门……,독 씨……,
day22_065,だ、大丈夫か？,"Док, п-погоди... Ты ранен.",你、你的伤……,괜찮아요?,
,その怪我……,С тобой всё будет в порядке?,没问题吗？,그 상처……,
day22_066,…\.\.…\.\.俺のことより、,"...Не волнуйся обо мне, малец.\.\.",…\.\.…\.\.先别管我了，,…\.\.…\.\.나는 내버려 두고,
,さっさとここを離れた方がいい。,"Мне просто... нужно, чтобы ты",你还是尽快离开这里的好。,당장 여기서 빠져나가라.,
,,ушёл отсюда.,,,
day22_067,隠れ家の場所は知ってるな？,"Ты ведь знаешь, где убежище Ви, да?",她的藏身处，你知道的吧？,은신처 위치는 알지?,
day22_068,僕のものとそっくりなラップトップだ。,Этот ноутбук... Он выглядит,跟我的一模一样的手提电脑。,사용하던 것과 똑같은 PC다.,
,ログイン画面が表示されてるけど……,"точь-в-точь как мой. Мне удалось его",上面显示着登录界面……,로그인 화면이 표시되어 있지만……,
,パスワードは知らないな。,"загрузить, но я не могу войти",但我不知道密码啊。,비밀번호가 있어야 할 것 같다.,
,,без пароля.,,,
day22_069,PCを閉じる,Закрыть,关闭电脑,PC를 연다,
day22_070,表面にR-codeが書いてある。,На поверхности написан R-код.,表面写着它的R-code。,화면에 R-codes가 쓰여 있다.,
day22_ad1,床にチェンソーが落ちている……,На полу лежит бензопила.,地上有一把链锯……,바닥에 전기톱이 떨어져 있다……,
day22_071,監獄の外で会うのは,"Привет, дружище! Давненько я не видел",咱俩好久没在监狱外头,감옥 바깥에서 만나는 건,
,久しぶりだな！,тебя без решётки между нами.,见面了啊！,정말 오랜만이네!,
day22_072,……,Кампанелла... Ты сбежал?!,……,……,
,どうやって脱出したんだ？,Как тебе удалось выбраться?,你怎么越狱的？,어떻게 탈출했어?,
day22_073,機業秘密だ。,"Хех, всего лишь ещё один маленький",器业机密，无可奉告。,기업 비밀이야.,
,,производственный секрет.,,,
day22_074,こんないい場所があったなんてな！,"Чувак, ты нашёл себе здесь шикарное",没想到还有这么好的地方啊！,이런 멋진 장소가 있을 줄은 몰랐는걸!,
,ゆっくり観光したかったけど……,"местечко! Жаль только, не сможешь",虽然很想好好参观参观……,느긋하게 구경하고 싶지만……,
,,провести мне полную экскурсию.,,,
day22_075,ここもいつ見つかるかわからないし、,"Нам надо сваливать отсюда, пока они",但这里被发现也只是时间问题，,"여기도 언제 발각될지 모르니,",
,用が済んだならさっさと脱出した方がいいぜ。,нас не нашли. Это лишь вопрос времени.,既然你办完事了，最好还是趁早开溜。,용건이 끝나는 대로 빠져나가는 게 졸겠어.,
day22_076,一緒に行こう！,"Давай, Джо! Прикрой мою спину!",咱俩一起走吧！,같이 가자!,
day22_077,……,...,……,……,
day22_078,……まあ、,Ладно... Хорошо.,……算了。这种时候，,"……뭐, 나도",
,いま戦えるやつと行動できるのは,"Полагаю, твоя грубая сила не помешает,",身边有个打手确实比较放心。,지금 싸울 수 있는 녀석과,
,心強いよ。行こうか。,чтобы выжить. В одиночку у меня,走吧。,행동하는 편이 든든해. 가자.,
,,всё равно нет шансов.,,,
day22_079,よーし、それじゃ,"Хех, я знал, что ты посмотришь",好！,"좋아, 그럼, 서둘러",
,ムーヴェーターに急ごう！,на вещи по-моему. А теперь поторопимся,那就马上去找移形升降梯吧！,공간 엘리베이터로 이동하자고!,
,,к транспортёру!,,,
day22_080,それにしても、,"Знаешь, я удивлён, что",话又说回来，,"그건 그렇고,",
,どうやってここまで……,тебе удалось меня найти.,你是怎么找到这……,어떻게 여기에……,
day22_ad2,\C[1]（……Wiからのテキストには,\C[1](Ви сказала мне уничтожить её ПК на,\C[1]（……Wi在信里叮嘱过，,\C[1](……Wi는 내게 PC를,
,「物理破壊しろ」って書いてあったな。,всякий случай... так что лучше,要我办完事就“物理破坏”它。,물리적으로 파기하라고 했지.,
,PCを壊してから先に進もう）,"позаботиться об этом,",先破坏了电脑再走吧）,PC를 파기한 뒤에 나가야겠어),
,,прежде чем я уйду.),,,
day22_ad3,僕のものとそっくりなラップトップだ。,Этот ноутбук... Он выглядит,跟我那台一模一样的手提电脑。,내 것과 똑같이 생긴 노트북이야.,
,,точь-в-точь как мой.,,,
day22_ad4,\C[1]（……PCを物理破壊、か……）,"\C[1](Ви хочет, чтобы я его уничтожил...)",\C[1]（……要破坏电脑……）,\C[1](……PC 파기라……),
day22_ad5,ラップトップはチェンソーで,Я распилил ноутбук Ви пополам.,电脑被链锯锯成了两半。,노트북이 전기톱으로,
,真っ二つになっている。,"Мне было жаль так его калечить,",,깔끔하게 잘려 있다.,
,起動は難しそうだ。,но теперь уж точно никто,想再启动恐怕很难了。,작동은 힘들어 보인다.,
,,не сможет его загрузить.,,,
day22_ad6,\C[1]（……PCを物理破壊、か。,"\C[1](Ви хочет, чтобы я его уничтожил...",\C[1]（……既然要破坏电脑，,\C[1](……PC를 파기하라고 했지.,
,これなら……）,"Может, я смогу это использовать.)",那么用它……）,이거라면……）,
day22_ad7,チェンソーでPCを破壊する,Уничтожить бензопилой,用链锯破坏电脑,전기톱으로 PC를 자른다,
day22_ad8,……これでよし。,"Ну, это уж точно сработает.",……好了。,……이러면 문제없겠지.,
,外に出よう。,Лучше мне идти.,走吧。,바깥으로 나가자.,
day22_081,……もしかして、,Если только... Погоди.,……你，,"……설마,",
,ずっと僕の後をつけてたのか？,"Ты что, всё это время следил за мной?",该不会一直跟在我后面吧？,계속 내 뒤를 밟았어?,
day22_082,いつから？,"Давай, выкладывай. Как долго?",什么时候开始跟的？,언제부터 따라왔지?,
,ドクは気付かなかったのか？,Ты и от Дока прятался? Или...,大夫竟然没发现你？,독 씨에게 걸리지 않았어?,
,紅友隊は……,"Ты уже был здесь, когда РЭД...?",还有红友队……,홍우대는……,
day22_083,さあ、どうだろうな！,Рассказать тебе сейчас — значит,哎呀，谁知道呢！,"글쎄, 잘 모르겠는데!",
,,разрушить всю загадочность!,,,
day22_084,……,...,……,……,
day22_085,……まずいな。,Чёрт... У нас компания.,……糟糕。,……야단났네.,
day22_086,どうしたの？,Что?!,怎么了？,왜 그래?,
day22_087,見ろよ、あれ。,"Вон там. Похоже, они охраняют",你看。,저기 좀 봐.,
,ムーヴェーターの入り口が見張られてる。,транспортёр. А нам уж точно не хочется,他们就守在升降梯门口。,공간 엘리베이터를 감시하고 있어.,
,抜け目ないやつらだ。,познакомиться с их оружием поближе.,真是滴水不漏。,정말 철저한 녀석들이라니까.,
day22_088,君が囮になって,Тебя им ни за что не одолеть.,你能不能去当诱饵，,네가 미끼가 되어,
,おびき寄せてくれないか？,"Как насчёт того, чтобы ты отвлёк",把他们引开啊？,놈들을 유인하면 되잖아?,
,どうせ殺されないだろ。,"их внимание, пока я проберусь внутрь",反正他们不会对你下杀手。,어차피 살해당할 위험은 없을 테니.,
,,и сделаю ноги?,,,
day22_089,やってもいいけど……,"Я мог бы, но... это не весело!",也不是不行……,그럴 수야 있지만……,
,ここで二手に分かれるのは,"Кроме того, снова разделяться — звучит",但是这种时候，,여기서 흩어지는 건,
,得策じゃないな。,"как не самая лучшая идея, правда ведь?",分头行动不太明智。,좋은 생각이 아닌 것 같아.,
day22_090,もっとおもしろい方法を探そうぜ！,Придумай план... поискуснее!,咱们想个更好玩的办法吧！,더 재미있는 방법을 찾자고!,
,ここには使えそうな建物が,Просто посмотри на всё это барахло.,旁边这些房子，,여기에는 제법 쓸만한 건물도,
,いっぱいあるしな！,"Должно же быть здесь что-то,",都很值得利用嘛！,많이 있으니 말이야!,
,,что мы можем использовать.,,,
day22_091,おもしろい方法って……,Серьёзно? Ты хочешь «поискуснее»?,什么叫更好玩……,재미있는 방법이라니……,
day22_092,なあなあ、見ろよ、あの看板！,"Эй, видишь вон ту вывеску?",喂你快看，那块招牌！,저 간판 좀 봐! 떨어질 것 같은데도,
