翻訳ID,日本語,英語,中国語（簡体字）,韓国語,備考
,そのへんのスコア持ちより賢いんだぜ。,"По крайней мере, умнее обычного рейтера.",我比你们大部分“有分的”还聪明得多。,주변 스코어 보유자보다 똑똑하단 말씀.,
day15_216,なのに、配給がないから腹減ってるんだ。,Но у меня кончились пайки. Я голоден.,可是我却没有配给，肚子快要饿瘪了。,그럼에도 배급이 없어서 배를 곯는 중이지.,
,買ってくれないか？,Так что... Хочешь купить немного?,所以你能不能帮帮忙？,"그래서, 안 살 거야?",
day15_217,……全部じゃなくていいから。,...Не обязательно всё.,……不用全买也可以的，买一点就好。,……전부 살 필요 없어.,
,すこしでも。ネズミと違って資産はあるだろ？,"У тебя ведь есть деньги, да? Ты не крыса.",你又不是老鼠，应该有钱的吧？,"이런 쥐와는 달리, 적지만 돈은 있을 거 아냐?",
day15_218,……,...,……,……,
day15_219,それよりさ。,У меня есть идея получше.,哎，先不说货的事了。,그것보다……,
,あたしたちと一緒に暮らさない？,Почему бы тебе не пойти жить с нами?,你要不要考虑来我们家，跟我们一起生活？,"너, 우리랑 같이 살지 않을래?",
day15_220,はあ？,Что?,啊？,뭐?,
day15_221,だってきみ、面白いもん！,Разве жить вместе не весело?,因为你这孩子太有意思了嘛！,"너, 재미있는 애 같아서!",
,どう？　買うよりよくない？,"Я бы сказала, это гораздо",怎么样？这条件比买你的货好吧？,어때? 좋은 제안이지?,
,,лучшее предложение.,,,
day15_222,……か、家族なんかいらないよ。,"Мне... Мне не нужна семья, понятно?",……我、我才不要有家庭呢！,"……가, 가족 따위 필요 없다고.",
,めんどうだし。,От неё одни проблемы.,对我又没好处，还麻烦得要死。,귀찮기만 하니까.,
day15_223,俺は頭がいいから一人でも,А я? Я и один достаточно умен.,我的脑子可好使了！,"난 머리가 좋으니,",
,生きていけるんだ。,Я прекрасно справлюсь сам.,靠自己一个人也可以活下去。,혼자서도 살 수 있어.,
day15_224,そんなこと言わずに！,"Ой, не стесняйся так!",哎呀，别这么见外嘛！,그런 말 하지 말고!,
,じゃあ決まりね！,Я не приму отказа.,那就说定喽！,"그럼, 같이 살기로 한 거다!",
day15_225,さ、入って！,"Идём, идём!",来，快进来！,"자, 들어오렴!",
,ジョバンニ、あんたのベッドの下空いてたよね？,"Джованни, дорогой? Освободи место",乔班尼，你的床下面还有空位吧？,"조반니, 네 침대, 밑에 아무도 안 쓰지?",
,,под кроватью!,,,
day15_226,……なんだあいつ？,...Что это с ней?,……她这人怎么回事？,"……저 여자, 대체 왜 저래?",
day15_227,さあ。気分じゃない？,Я не знаю. Она просто такая.,不知道。大概今天心情好？,"글쎄, 기분이 좋아서 저러는 거 아닐까?",
day15_228,それだけ？,И всё? серьёзно?,啥？,그게 이유라고?,
day15_229,……お前も、いいのかよ？,...И тебя это устраивает?,……你也就这反应啊？,"……너, 정말 괜찮냐?",
day15_230,うち、こういうことよくあるから。,Такое случается постоянно.,我们家经常发生这种事的。,우리 집은 이런 일이 잦거든.,
,慣れた。,Я привык.,我都习惯了。,이미 익숙해.,
day15_231,……変わってるな。,Ты странный.,……你们家可真怪。,……신기한 녀석들이네.,
day15_232,そっちもね。,Ты тоже.,你不也挺怪嘛。,너도 마찬가지거든.,
day15_233,ともかく、よろしく。,В общем... Добро пожаловать домой.,总之，先进家门吧。,"아무튼, 잘 부탁해.",
day15_234,……,...,……,……,
▼2-13　DAY18／ゼロデイ１５日目,,,,,
day15_235,フルダイブ用ポッドだ。,Я могу использовать эту капсулу для,这是浸没舱。,풀 다이브용 포트다.,
,中で横になればあとは全自動で,"полного погружения. Всё, что мне нужно",只需躺进去，,안에 들어가 누우면 나머지,
,ダイブさせてくれる。,"сделать, – это лечь внутрь, и она",就会自动开始完全浸没。,과정은 자동으로 진행된다.,
,,позаботится об остальном.,,,
day15_236,\> 中に入る,\> Залезть,\> 进入,\> 안에 들어간다,
day15_237,\> やめておく,\> Не залезать,\> 算了,\> 그만둔다,
day15_238,ユミの様子が気になる……,Юми звучала довольно напряженно...,好在意由美要干嘛……,유미가 신경 쓰인다……,
,早くフルダイブした方がよさそうだ。,"Наверное, мне стоит совершить",还是快点去浸没舱浸没吧。,서둘러 풀 다이브를 하는 게 좋겠다.,
,,полное погружение.,,,
day15_239,……,...,……,……,
day15_240,犯人は\.\.……,"Ты виновен, я знаю это\.\....",只要被我抓到\.\.……,범인은\.\.……,
day15_241,\{\{惨殺！！！,Я РАЗОРВУ ТЕБЯ НА КУСКИ!,\{\{当场碎尸万段！！！,\{\{찢어 죽일테다!!!,
day15_242,……生きて出られると思うなよ。,...Ты не уйдешь отсюда живым.,……要是你偷的，别想活着出去。,……살아서 돌아갈 생각 말라고.,
day15_243,ぼ、僕じゃないよ。,"Я-Это не я, клянусь.",不、不是我啊。,"나, 난 아니야.",
day15_244,\{じゃあ誰だ！？\},\{Тогда КТО ЭТО СДЕЛАЛ?!\},\{那是谁？！\},\{그럼 누구지?!\},
,吐け！！　目撃証言を寄越せ！！,Выкладывай! Рассказывай всё!,快说！！你都知道些什么！！,불어!! 본 걸 전부 말하라고!!,
day15_245,知らないよ！,Я не знаю!,我什么都不知道啊！,모른다니까!,
day15_246,ちくしょう、,"Думаешь, умный, да?",混账，,제기랄.,
,ナメやがって……,Гребаный задрот...,竟敢挑衅我……,완전히 깥보고 있군……,
day15_247,\{誰だッ！！　\},"\{Так кто же это, чёрт возьми,}",\{到底是谁啊！！！\},\{누구냐!!\},
,この中にいんのは分かってんだッ！！,\{был?}!\ Признавайтесь! Это,我知道你就在这！！！,이 안에 있다는 거 다 알아!!,
,,кто-то из вас!,,,
day15_248,アタシが冷蔵庫から目を離したのは,Меня не было у холодильника два часа.,我不就两个钟头没顾冰箱……,내가 냉장고에서 눈을 뗀 것은,
,たった２時間……\.\.\.その間、,ДВА. ЧАСА.\.\.\. И никто не входил и не выходил,这期间……\.\.\.,고작 2시간……\.\.\.그 시간 동안,
,アジトに出入りした者はいなかった！！,из убежища!,根本没人出入基地！！,아지트에 드나든 녀석은 없었어!!,
day15_249,お前らしかいないんだッ！！,"Это значит, это ДОЛЖЕН был быть",所以小偷就在你们之中！！,"즉, 물건을 훔친 범인은!!",
,盗めたのはッ！！,"кто-то из вас! Так кто же,",,너희 뿐이라는 말이다!!,
,,"чёрт возьми, вор?!",,,
day15_250,……\.\.,.\..\..\.,……\.\.,……\.\.,
,そう言われてもなあ。,Без понятия.,就算你这么说。,그런 소리를 해도 말이다.,
day15_251,こっそり自分で,"А ты уверена, что сама его, типа,",嗳～搞不好啊，,자기도 모르게,
,食べちゃってたりしてー♡,не съела? Хи-хи.,就是你自己吃掉的呢～♡,몰래 먹어버렸다던가~?♡,
day15_252,\{んなわけあるかッ！！,\{Я НЕ ЕЛА!,\{我哪可能干这事！！,\{그럴 리가 있겠냐!!,
day15_253,……,...,……,……,
day15_254,そりゃ、作りながら一度は頭をよぎったよ。,"В смысле, конечно, МОЖЕТ,",这个嘛……做的时候我的确想过。,솔직히 만들면서 생각한 적이 있기는 했지.,
,あんなヤバいもん……心の弱いヤツなら、,я и подумывала об этом. Более слабый,这么要命的东西……要是谁意志不坚定，,그 엄청난 작품은…… 마음 약한 녀석이었다면,
,欲望に負けちまうかもしんねーッて……,"человек сломался бы и съел всё целиком,",没准儿会输给欲望……,욕망에 굴복하고 말았겠지……,
,,"ещё до того, как он был готов.",,,
day15_255,でも耐え抜いた。,Но я не сломалась! Я устояла!,但我还是忍住了。,나도 겨우 떨쳐냈으니까.,
,……それが、まさか……,Я прошла через все это...,可是没想到……,"……그랬는데, 설마……",
,身内に裏切られるなんて……,только чтобы один из ВАС предал меня!,竟然会被自家人偷走！,내부에 배신자가 있었을 줄이야……,
day15_256,\{くそおおおおおッ！！！,\{ЧЁРТ ПОБЕРИ!,\{可恶啊啊啊啊啊啊！！！,\{제엔장~!!!,
,リーダー、すみませんッス！！,"Прости меня, босс!",首领，我对不起你啊！！,"리더, 죄송함다!!",
day15_257,……そもそも、,Эм...,说了半天，,"……저기,",
,何が盗まれたんだ？,А что именно украли-то?,你到底丢了什么啊？,뭐가 사라졌는데 저래요?,
day15_258,ケーキだとよ。,"Торт, очевидно.",说是蛋糕。,케이크다.,
,Wiに頼まれて作ってた特別なものらしい。,"Ви заказала, чтобы сделали особенный.",好像是Wi特意跟她订做的。,Wi의 부탁으로 특제 케이크를 만든 모양이더군.,
day15_259,ここじゃ、豪華な食べ物はなかなか,"Здесь трудно достать изысканную еду,",我们这儿很难弄到复杂的食物嘛……,그런 고급 음식은 여기서 좀처럼,
,手に入んねぇからな……,поэтому нам приходится все делать самим.,,손에 넣기 힘드니 말이야……,
day15_260,\C[1]（ケーキ……？）,\C[1](Торт?),\C[1]（蛋糕……？）,\C[1](케이크……?),
day15_261,\{これだ！！,\{ЭТОТ\!,\{长这样的！！,\{이거다!!,
day15_262,……\.\.\.え、\.\.これ？,...\.\.\.Что?\.\. Этот?,……\.\.\.啊？\.\.这个？,……\.\.\.뭐? \.\. 저게?,
day15_263,本物の動物性クリームに地球種のイチゴ、,"Настоящие сливки из животного молока,",全部采用真正动物奶油和地球草莓，,"진짜 동물성 크림에 지구제 딸기,",
,小麦……全部、アタシが材料から作った,"земляника земных сортов, мука...",还有小麦……是我从原材料开始做的，,밀…… 전부 내가 구한 재료로 만든,
,宇宙にたったひとつの特別製だ……,Все кропотливо сделано вручную.,全宇宙都只有这一块……,이 우주에 하나밖에 없는 특제 케이크지……,
,,Единственный в своём роде торт.,,,
day15_264,\{ああ、そうだな！！,"\{Точно, Раби\! ВОТ ОНО\!",\{对，没错！！,"\{그래, 맞아!!",
,それしかない！！,Это единственный способ\!,就得用上这个！！,역시 그게 좋겠군!!,
day15_265,……な、なにが……？,Чт-Что за единственный способ?,哪、哪个……？,"……뭐, 뭐가……?",
day15_266,……何って、,А что же ещё?,……这还要问？,……뭐냐니.,
,処刑方法に決まってるだろ？,"Наказание, тупица.",当然是刑罚了。,당연히 처형 방식 아니겠어?,
day15_267,古代、地球人は罪を犯した時、,В старые времена на Земле преступников,古代地球人犯了罪，,고대에 죄를 범한 지구인은,
,責任をとるために自分の腹を自分で切り裂き、,заставляли вспарывать себе животы,为了负起责任都要切开自己的肚子，,책임을 지겠다는 뜻으로 직접 배를 가르고,
,介錯人に首を斬り落とさせたらしい。,и отрубали им головы.,还要找个“介错人”帮忙砍头呢。,종자가 목을 치는 방식이 있었다더군.,
day15_268,ハラキリっつう風習だ。,Раньше это называли «харакири».,好像是叫切腹什么的习俗。,할복이라는 풍습이랬지.,
,犯人には、この伝統にのっとって……\.\.\.,Как только мы найдем этого вора...\.\.\.,要是让我抓到是谁偷的，我就根据这个传统……\.\.\.,전통에 따라……\.\.\.,
,死んでもらう。,Время для харакири.,送他去死。,범인은 이렇게 처형하겠어.,
day15_269,もし、犯人が複数で……,"Мне все равно, будет ли это несколько",如果小偷不止一个……,만약 범인이 다수에……,
,盗みの実行犯が別にいたとしても、,"виновных, или если ты не участвовал",就算只有一个人负责偷，,케이크를 훔친 범인이 있었다 해도,
,ケーキを食べたなら連帯責任だ。,"в краже торта, а только немного съел.",只要谁吃了那块蛋糕，也都同罪。,그걸 먹었다면 연대 책임을 지게 될 거야.,
day15_270,全員、,"Если ты хотя бы ПОНЮХАЛ этот торт,",让我抓着，,전부 다 예외 없이,
,問答無用で処刑してやる！,ты вспорешь себе живот\!,不听狡辩，直接处死！,처형해 버릴 테니 그리 알아!,
day15_271,……,...,……,……,
,\C[1]（まさか、ケイト……）,\C[1](Только не говори мне... Кейт?),\C[1]（凯特，你不会真……）,"\C[1](설마, 케이트가……)",
day15_272,……,...,……,……,
day15_273,\C[1]（やっぱりだ！,\C[1](Я так и знал\!,\C[1]（我就知道！,\C[1](역시 그랬어!,
,まずい。絶対まずい……,"О боже, это плохо...",糟糕了，这下糟糕了……,엄청나게 위험한 상황이잖아……,
,死にたくない！）,Я не хочу умирать\!),我不想死啊！）,난 죽기 싫어!),
day15_274,ケーキセットが保管してあった冷蔵庫のログの,"Преступник замёл следы, зашифровав",放这碟蛋糕的那台冰箱，,케이크 세트를 넣어둔 냉장고의 로그,
,認証キーは、犯人の手でバラバラに暗号化されて,ключ доступа к холодильнику и разбросав,查看访问纪录的口令被小偷拆得乱七八糟，,인증키는 범인이 직접 암호화하여,
,いま、サーバー内部に散らばっている。,его по всему серверу.,还加密了，藏到服务器各个角落。,서버 곳곳에 뿌려져 놓았더군.,
day15_275,隠蔽とも言えない幼稚な手段だ。,"Они что, серьёзно думали, что это меня",这么幼稚的手段，以为瞒得过我？,은폐도 뭣도 아닌 유치한 방식이야.,
,よっぽどバカにしてるらしい。,"остановит? Должно быть, они считают",看来老娘不发威，真当我是病猫。,상당히 바보 취급 하는 것 같다만……,
,,меня идиоткой.,,,
day15_276,……けど、どっちにしろ犯人の命は長くない。,...Да пофиг. Ублюдок скоро истечет кровью.,罢了，反正那小偷命没多长了。,어느 쪽이건 범인의 명줄은 얼마 남지 않았어.,
,ログはブロックチェーンだから絶対消えないし、,"Кроме того, этот лог на блокчейне.",访问日志存在区块链上，所以绝对不会消失，,"로그는 블록체인 방식이라 사라질 일은 없으니,",
,認証キーさえ集めて復元さえしちまえば1発だ！,"Как только я восстановлю ключ, им крышка\!",只要能拼好访问口令，一毫秒就知道是谁！,인증키를 모아 복원하면 끝이야!,
day15_277,つまり、バラバラになってるだけってか？,Так это всё? Они просто... разделили,也就是说，口令只是被拆成了几段？,즉 조각냈을 뿐이란 말이지?,
,……なんかおかしくねえ？,ключ и спрятали его? Не кажется это,……不觉得有点奇怪吗？,……조금 이상하지 않나?,
,罠かゲーム感覚にしか見えないんだが……,"немного странным? Это что, какая-то игра?",如果不是圈套的话，简直像在逗你玩……,함정이거나 장난으로밖에 안 보인다만……,
day15_278,\{というわけで！\},\{КАК БЫ ТО НИ БЫЛО\!\},\{综上所述呢！\},"\{아무튼, 그런 고로!\}",
,今回は皆に対戦形式で認証キーを集めてもらう！！,Вы будете соревноваться в сборе ключей\!,这次就由大家以对战的形式帮忙收集验证口令！！,"이번에는 전원, 대전 형식으로 인증키를 모아올 것!!",
day15_279,誰か一人に頼むと、そいつが犯人だった時に,"Нельзя, чтобы один человек делал всю",如果全交给一个人去找，这人又正好是小偷，,한 명씩 부탁하면 범인이 인증키 조각을,
,隠蔽されかねないからな。,"работу. А что, если он и есть виновник?",肯定会趁机毁灭证据的。,은폐할 가능성이 있으니까 말이야.,
,全員でかかれば小細工の余地もない！,"Таким образом, они не смогут провернуть",拉所有人一块，就没法动手脚了！,전원이 나선다면 꼼수를 부릴 여유도 없겠지!,
,,никаких трюков\!,,,
day15_280,……ここ、フルダイブ空間だぞ？,...Разве виновник не мог бы обмануть,可这是完全浸没空间啊。小偷要是有点本事，,……여기는 풀 다이브 공간이지 않나?,
,器用なやつなら二重行動できちまうんじゃ？,нас вне полного погружения?,直接在外头搞小动作不就完了吗？,능력자라면 동시 행동도 가능할 텐데?,
day15_281,なんだジョバンニ！？,А ТЫ ЧТО ХОЧЕШЬ?\!,你又举啥手！有屁快放！,"뭐냐, 조반니?",
day15_282,対戦とか言わずに,"Вместо того чтобы заставлять нас",根本不用让所有人对战这么麻烦，,대전 같은 걸 할 시간에,
,自分で全部集めた方が,"собирать ключи, почему бы тебе просто",你自己一个人去找回所有的片段，,직접 조각을 모으는 게,
,確実なんじゃないか？,"не собрать их самой? Таким образом,",不是更保险吗？,더 정확하고 빠르지 않아?,
,,виновник не сможет вмешаться.,,,
day15_283,それはダメだ！　なんたって,"Ни за что! Ты хоть знаешь, какой это",那可不行！,"그건 싫어! 이유는 하나,",
,\{面倒くさい\}からな！！,был бы \{геморрой?!\},那岂不是\{麻烦死了\}！！,\{귀찮기\} 때문이다!!,
day15_284,アタシのせいじゃねぇーーーし。,"Кроме того, это даже не моя вина, но...",再说了，本来就不是我的错～～,애초에 내 잘못도 아니고 말이야~,
,でもリーダーに迷惑はかけらんねぇしな……,Я не хочу подвести босса.,但又不能对不起首领……,그래도 리더에게 폐를 끼칠 수는 없으니……,
day15_285,どうにかうまく理由つけて、,Лучше придумать отговорку и,所以只要我想个好点的借口，,적당한 이유를 둘러대고,
,全員にやらせれば一瞬だろ！！,заставить всех остальных делать,使唤大家一起干不就超快了！！,함께 찾는 게 더 빠르다고!!,
,,всю работу!,,,
day15_286,ついでに罪のなすりつけ先も手に入るし！,"И в довершение всего, я смогу свалить это",而且还能趁机甩黑锅给别人！,거기다 범인도 잡을 수 있고 말이야!,
,アタシってやっぱ天才策略家だなー！！,"на кого-нибудь другого!",我可真是个天才军师啊～！！,역시 지략에서 날 따라올 녀석은 없다니까~!!,
,,"Боже, какая я умная.",,,
day15_287,……\.\.\.だろうと思ったよ。,Верно...\.\.\. Так и думал.,……\.\.\.我就知道八成是这样。,……\.\.\.내 저럴 줄 알았지.,
day15_288,\{スニファー！！\},\{Сниффер!\},\{小闻！！\},\{스니퍼!!\},
,お前が第一容疑者だからな。,"Смотри у меня, приятель.",行吧，那小闻现在是第一嫌疑狗。,제1용의자는 너야.,
,,Ты мой главный подозреваемый.,,,
day15_289,\{ジョバンニ！\},\{Джованни!\},\{乔班尼！你第二！\},\{조반니!\},
,新入りだからって容赦しねーぞ。,"Не думай, что я буду с тобой нежничать,",别以为你新来的我就会网开一面。,신입이라고 해서 봐줄 생각 없으니 그리 알아!,
,,новичок.,,,
day15_290,\C[1]（何に巻き込まれてるんだ……？）,\C[1](Во что я ввязался?),\C[1]（怎么就扯上我了……？）,\C[1](어쩌다 이런 일에 휘말리게 된 거람……?),
day15_291,\{ケイト！\}……は,"\{И ты, Кейт!\}",\{还有凯特！\}你……,"\{케이트!\} ……너,",
,なんで嬉しそうなんだ……？,Почему ты выглядишь такой счастливой?,你乐什么？干嘛嬉皮笑脸的？,뭐가 그렇게 즐겁냐……?,
day15_292,なんでもなーい♡,"О, ничего! Хи-хи.",嗯？没有呀♡,아무것도 아니야~♡,
day15_293,\{ドク！！\}　は,"\{Что касается тебя, Док!\}",\{大夫！！\},\{독!!\} ……은,
,ついでによろしく！,"Я на тебя рассчитываю, дружище.",你来帮我抓犯人！,그렇게 됐으니 잘 부탁함다!,
day15_294,俺、忙しいんだけどなあ。,Лучше бы это было быстро.,我很忙的好吗。,바쁜 몸이다.,
,手短に頼むぞ。,"Я занятой человек, знаешь ли.",你最好搞快点。,짧게 끝내 다오.,
day15_295,カムパネルラが監獄から出られないのは,"Мы уже знаем, что Кампанелла не мог",各项数据都可以证明，,캄파넬라가 감옥에서 나올 수 없다는 건,
,各種データから証明済みだし、,"этого сделать, так как он в тюрьме.",康帕聂拉没法出那个笼子，,"각종 데이터를 통해 증명했고,",
,リーダーは盗むわけがない！,Босс тоже не стала бы красть торт.,然后首领又不可能偷蛋糕！,리더가 범인일 리는 없어!,
day15_296,よって２人は容疑者から,Так что мы можем исключить этих двоих из,因此这两个人排除出怀疑范围！,"따라서, 그 둘은 이번",
,外すものとする！,круга подозреваемых!,,용의자에서 제외할 거야!,
,下手人はお前らの誰かだ。,"Это значит, что вор сейчас с нами.",小偷就在你们几个之中。,하수인은 너희 중 하나겠지.,
day15_297,犯人は……,Просто подожди...,要是被我抓到……,범인은……,
,\{覚悟しろよ。,\{Я найду тебя.,\{皮子收紧点。,\{각오 단단히 해.,
day15_298,……言っとくけど、,"Это и тебя касается, Раби.",……还有我先提醒一句，,"……라비, 말해 두는데,",
,お前も容疑者の一人だからな。ラビ。,Я за тобой слежу.,你也是嫌犯之一啊，拉比。,너도 용의자 중 하나라고.,
day15_299,もし犯人なら……,"Мои когти ОЧЕНЬ острые, знаешь ли.",如果是你偷的……,만약 범인이라면……,
day15_300,よし！！　それじゃ,"Ну что ж, тогда! Начнем с...",好！！那么首先……,"좋아!! 그럼,",
,最初は……スニファーと、ジョバンニ！,Сниффер! И Джованни!,从小闻和乔班尼开始！,먼저…… 스니퍼와 조반니!,
,ゲームステージにアクセスしろ！,Отправляйтесь на игровую арену!,都给我接入游戏舞台！,게임 스테이지에 접속해!,
